{
  "version": 2,
  "canvas": {
    "width": 16,
    "height": 16
  },
  "palette": [
    {
      "slot": "I",
      "colour": "#1A1B26FF"
    },
    {
      "slot": "C",
      "colour": "#2B3048FF"
    },
    {
      "slot": "A",
      "colour": "#3A3E55FF"
    },
    {
      "slot": "K",
      "colour": "#454C6EFF"
    },
    {
      "slot": "D",
      "colour": "#565F89FF"
    },
    {
      "slot": "F",
      "colour": "#A9B1D6FF"
    },
    {
      "slot": "L",
      "colour": "#E4E8F5FF"
    },
    {
      "slot": "E",
      "colour": "#4A3227FF"
    },
    {
      "slot": "H",
      "colour": "#6B4A3AFF"
    },
    {
      "slot": "N",
      "colour": "#8A6349FF"
    },
    {
      "slot": "T",
      "colour": "#D3A995FF"
    },
    {
      "slot": "S",
      "colour": "#F0CDBFFF"
    },
    {
      "slot": "R",
      "colour": "#F7768EFF"
    },
    {
      "slot": "Y",
      "colour": "#E0AF68FF"
    },
    {
      "slot": "G",
      "colour": "#9ECE6AFF"
    },
    {
      "slot": "B",
      "colour": "#7AA2F7FF"
    },
    {
      "slot": "P",
      "colour": "#BB9AF7FF"
    }
  ],
  "clips": [
    {
      "id": "idle",
      "name": "idle",
      "fps": 4,
      "frameCount": 2
    }
  ],
  "layers": [
    {
      "id": "layer",
      "name": "Layer",
      "visible": true,
      "locked": false,
      "opacity": 255,
      "mode": "normal",
      "storage": "animated",
      "cels": [
        {
          "clip": "idle",
          "frame": 0,
          "rows": [
            "................",
            "................",
            "................",
            "................",
            "..RRRRRRRRRRRR..",
            "..RRRRRRRRRRRR..",
            "..RRRRRRRRRRRR..",
            "..RRRRRRRRRRRR..",
            "..RRRRRRRRRRRR..",
            "....RRRRRRRR....",
            "....RRRRRRRR....",
            ".....RRRRRR.....",
            "......RRRR......",
            ".......RR.......",
            "................",
            "................"
          ]
        },
        {
          "clip": "idle",
          "frame": 1,
          "rows": [
            "................",
            "................",
            "................",
            "................",
            "................",
            "..RRRRR..RRRRR..",
            "..RRRRR..RRRRR..",
            "..RRRRR..RRRRR..",
            "..RRRRRRRRRRRR..",
            "..RRRRRRRRRRRR..",
            "....RRRRRRRR....",
            "....RRRRRRRR....",
            ".....RRRRRR.....",
            "......RRRR......",
            ".......RR.......",
            "................"
          ]
        }
      ]
    }
  ]
}
