{
  "version": 2,
  "canvas": {"width": 3, "height": 2},
  "palette": [
    {"slot": "A", "colour": "#112233FF"},
    {"slot": "B", "colour": "#CC8844FF"}
  ],
  "clips": [
    {"id": "idle", "name": "Idle", "fps": 8, "frameCount": 1}
  ],
  "layers": [
    {
      "id": "background",
      "name": "Background",
      "visible": true,
      "locked": false,
      "opacity": 255,
      "mode": "normal",
      "storage": "shared",
      "cels": [{"scope": "all", "rows": ["AAA", "A.A"]}]
    }
  ]
}
